Queries,Clicks,Impressions,CTR,Position
llc pros and cons,29,64,45.31%,3.8
pros and cons of llc,5,15,33.33%,4.9
how to run an llc,5,8,62.5%,4.3
running an llc,4,7,57.14%,8.1
successful llc companies,3,4,75%,1.0
pros and cons of an llc,2,3,66.67%,5.0
pros cons of llc,2,2,100%,6.0
pros and cons of forming an llc,1,1,100%,4.0
is llc the best for a small business,1,1,100%,9.0
how to start llc,1,4,25%,14
llc for small business,1,2,50%,4.0
small business llc,1,3,33.33%,8.0
best way to start an llc,1,1,100%,9.0
how to start an llc,1,8,12.5%,15
how to start and llc,1,2,50%,28
starting an llc,1,4,25%,17
best way to create an llc,1,3,33.33%,7.0
llc pros,1,1,100%,4.0
llc tips,1,2,50%,5.0
best way to create llc,1,1,100%,4.0
